Tweet Text,label (annotator1),label (annotator2),label (annotator3)
There is no ideological or political conviction would justify Mwaguya not to be Mombasa Senator2017 #MwaguyaForSenatorMsa,,,
Officials posted in FATA are busy in making illegal assets. We demand immediate resignation of incompetent administration & investigation.,,,
Evidence confirming Clintons exploited the massive 2010 Haiti disaster to enrich themselves and their friends,,,
"Liked on YouTube: IVC Attorney Near Me Litchfield Park, AZ -",,,
SPAIN: Muslim men beat up a woman who was standing alone outside of a bar. Euro women are under attack.,,,
"So wait- they killed a S. Korean businessman inside Camp Crame, collected a 5M PhP ransom to weaken the aaaah o…",,,
"Fecal pollution found at *1500x* the safe level at Cox's Creek, Auckland",,,
Former #Phillies prospect Matt Imhof is retiring from baseball after losing his right eye in workout accident.,,,
Details of plans for new Ikea in Greenwich. Is it innovative? Can traffic & public transport cope with it?,,,
"Obama’s pattern of malfeasance is clear. He is flouting constitutional limits on his authority, violating the law.",,,
"10 Reasons #Hamas Should Not Be in Any Government Hamas is a designated terror org. In the U.S., CAIR is HAMAS",,,
Protesters marching from City Hall to Loews Philadelphia Hotel,,,
Friday's Lakers News: Zubac exceeding Walton's expectations #Lakers,,,
"100 residents evacuated as fire breaks out at Brooklyn apartment building, @nbcnewyork",,,
Time check:3:30AM Kuwait time.Still awake para sayo Maxine at bnsang Pinas let's do this..power votes/tweet/RT.. #MissUniverse #Philippines,,,
".@RealJack Left whines about Trump criticizing adults who should be able to take it, meanwhile they viciously attack innocent children.",,,
"And Leicester are not losing. It's a packed house at St. Mary's, they're a wall at the back & they're getting long…",,,
"and this is why America can't have nice things, like healthcare. Or social security. Or medicare. Or a VA that work…",,,
"Please inform your reportr, there is more than 10000 girl studing in USA from KSA, they are not escaping",,,
"And CHRIS WALLACE'S dad was MIKE WALLACE, Who worked for the CORRUPT & BIASED CBS outlet for decades. Apples don't fall far from trees.",,,
"Fresh Air, Andrew Solomon (Nonfiction) - Terry Gross | News |2841075 #News #News",,,
"In other news, ISIS has secured a massive stockpile of Orville Redenbacher.",,,
Signs and spirit remain on National Mall after Women's March:,,,
Memorial Mass to be held for Cianci one year after his death,,,
"Through no fault of his own, Beaver is back for another shot at a forever home! #lurchers",,,
De Mistura Unlikely to Join Trilateral Consultations on Syria on Sunday #worldnews #actu,,,
I just signed the pledge to resist Trump's pipeline plans. #NoDAPL #NoKXL via @ClimateHawkVote,,,
NEWS: Vulnerable 14-year-old missing from Guildford who has links to West Byfleet and Addlestone via Surrey Police,,,
Indian pharma firm caught shredding documents at 1am by FDA | Pharmafile,,,
Great to see Google home page profile Berkeley disabled activist Ed Roberts! @Berkeleyside story about his mom today:,,,
Look at Toronto's cops and their brutal methods. When will white people march against them?,,,
Medical Examiner's office confirms part of skull found at Wauwatosa construction site is human:…,,,
Review finds no wrongdoing in Flynn's talks with Russian ambassador,,,
"Injuries reported after severe storm hits Hattiesburg, MS. A private college and fire station are damaged.",,,
Poor Merrick. Which hilarious autocorrected to Poor America.,,,
"Here's a look at the Richardson Family home in Grant Parish after last night's storm. A lot of property damage, but…",,,
US and Brazilian researchers study toxic stress in children,,,
"Sevilla dominating set pieces, aerial duels against Osasuna. Another goal from a header just now. Incredible...",,,
Arsenal press conference live updates as Arsene Wenger speaks ahead of Southampton FA Cup clash…,,,
"This monumental figure was discovered in March 1912. Tell Halaf is an archaeological site in northeastern Syria, ne…",,,
Six Britons killed in Saudi crash via @franmejia_0,,,
Update: NWS upgrades Ithaca area to winter storm warning #Twithaca,,,
#GunSense #guns American Made AR-15 Shotgun Coming Standard Manufacturing SKO SHOT Show 2017…,,,
Our thoughts #ThisWeek are with the friends and families of the firefighters who have died at the fire and building…,,,
easyJet : shareholder Stelios plans protest vote against fleet expansion,,,
OK just fire Dallas into the sun. The Sabres got screwed here tonight.,,,
Austria shuts its door to about 300 non-Muslim Iranians hoping to use the country to reach new homes in the US.,,,
"#earthquake Magnitude 1.43 occurred 10km WNW of Cobb, California 2017-01-26T08:42:06.190Z UTC #didyoufeelit?",,,
"MI6 agent Steele says FBI sat on Russian investigation info, despite dropping HRC email letters.…",,,
Maxine Waters surrounded by Black Congressional Caucus before they all took the stage. Lotta hugging. #WomensMarch,,,
"Kuwait Hangs 7 Convicts, Including a Prince by CEYLAN YEGINSU via NYT The New York Times",,,
"I tried to the place them in another wall and they fell, the glass broke, they are all dead. I'm sorry Brent. DEAD…",,,
[security-announce] SUSE-SU-2017:0227-1: important: Security update for Linux Kernel Live Patch 0 fo,,,
Tinker Street serves three-course meal to homeless at Wheeler Mission.,,,
"How To Shoot A Rifle With World Champion Shooter, Jerry Miculek (AR15, TAVOR, & SCAR) | TruthNation",,,
Tens of thousands of protesters spill into Chicago's downtown,,,
"Lingering Rain, Mountain Snow To Fall Before Storm Moves Out Of San Diego County",,,
Larson Electronics Releases a 70 Watt Explosion Proof LED Light with... -,,,
Italy's 10-year bond yields have climbed to their highest since the Greek crisis on election jitters…,,,
"Women are not allowed to drive cars in Saudi Arabia, but they can drive tanks and fight mercenaries in Syria.",,,
Media assisted partisan intel chiefs in their leak campaign against POTUS. Rank and file are cheering his remarks against press. Interesting,,,
"And ppl were worried abt Packers WRs not playing lol....this is to get to Houston dawg, ain't got time for injuries! #GBvsATL",,,
Border residents wish money for Trump's wall would pay for something useful instead,,,
Seth has the ball resting in his palm not his fingertips so steph should be shooting better cuz of this,,,
Question: where are the religious right categorized who shot a killed doctors outside of Planned Parenthood clinics?,,,
Viewer video of vehicle fire at Wonderland and Riverside this morning. #LdnOnt,,,
OPEC Set to Maintain Policy as Oil Glut Worsens #FoxNews... #FoxNews,,,
Warning FCA focus could shift to smaller firms,,,
Kindly update my deposit LAP7VR881R Confirmed. Ksh100.00 sent to BETIN KENYA 25/1/17 at 3:02 Pm. my user is 1755475,,,
Currently the US Border Patrol estimates it only stops 30-40% of illegal immigrants that pass through Mexico #TrumpWall #Trump #MAGA,,,
"Mitchell, u are too smart to use those phony numbers. Those don't count the long term unemployed and those that gav…",,,
DC Water reports that Spring Rd. between 13th and 14th Streets NW will be closed for water service repairs for 6-8 Hrs,,,
Tornado Watch likely coming out for parts of south Arkansas soon:,,,
"At Least 31 Killed in Clashes between IS, Syrian Army near Palmyra",,,
Neighbors in Warren charged in heroin overdose death of 16-year-old girl,,,
#AAP_Ka_Dhokha Goans & Punjabis Watch Plight & Misery of Delhities B4 Casting Precious Vote To Thug @ArvindKejriwal,,,
"Qualcomm to continue supplying Apple with chips despite $1B lawsuit, considering legal rebuttal -",,,
New post: The White City Estate and the attack on council housing:,,,
Hwarang posted a photo of Kim Taehyung (#BTS V) with his co-stars on Facebook.,,,
Catch Mayor Darling's State of the City Address live here:,,,
"Meet Moose, NSALA's rescue cat looking for a new home - Movie TV Tech Geeks News",,,
Wanted: Suspects for Commercial Burglary in the 3rd District [VIDEO],,,
Her is May The Prime Minister of UK - Avoiding The Question FOUR times about her knowledge of Trident missfire?,,,
What if California simply decided to break away from the USA and take its independence?,,,
"City Commissioner John Ingram says McAllen/RGV residents have ""opened their hearts"" to 53,000 immigrants at Sacred Heart Catholic Church.",,,
A serial killer patiently waits the next victim in Last Summer's Evil #booktrailer #thriller,,,
Twelve Year Old Boy Picked Up On Terror Suspicion In Austria: From EWN: A 12… #islamofobi,,,
Comparing the crowds at Donald Trump’s and Barack Obama’s inaugurations,,,
America's Failure in Syria's Civil War,,,
". OH NO, he's back with another stupid tweet. Sean and Kellyanne in for a bad day tomorrow explaining...",,,
"AMA. Our ICO begins in 4 Days, We are the creators of an Augmented reality turn based battle Game based on the Bitc…",,,
UPDATE: Left-Wing Domestic Terrorist Charged with Conspiracy for Plotting Attacks…,,,
James M. Cox Foundation contributes $2 million to Centennial Olympic Park,,,
Major explosion in Tel Aviv. Ambulances on site. Cause not yet clear.,,,
"G Valley mobile site, 'hot issue' Sandara Park, the number of votes of 200 million super-debut 'topic'",,,
GMOs and Glyphosate and Their Threat to Humanity:,,,
"Report revealing @Qatar role in financing Al-Qaida and Jihadists.. and think tank ""boyish analysts"".",,,
"Breaking News: Emboldened by President Trump, Israel approved 2,500 new settlement homes in the West Bank",,,
"Toxic substances', including #glyphosate, found in most nappies sold in France So not just tampons and panty liners",,,
Muslim tried to get to heaven in only way Koran guarantees: by killing,,,
UAE consulate in US warns of dangerous weather conditions,,,
"Ontario will be doubling municipal share of gax tax from 2 cents per litre, to 4 cents per litre by 2021. Money wil…",,,
Francistown based ambulance flips over attending accident in Serule. Nurses and driver injured. #BWRoadSafetyAlerts,,,
Police: Man used knife to try to rob woman he met on online dating site(Orlando news),,,
"[INFOGRAPHIC] The trial of 6 persons involded in N24bn alleged Police pension scam stalled as case enters 1,758 day…",,,
Vanessa Hudgens under investigation for after posting #Instagram pic #Instagram,,,
"U march to KILL Bsbies? Ignoring Women R Sold into Slavery & Children Married off to Be Raped, Brides of Abusers ?",,,
#Germany: 16 year girl jailed by court for 6 years for what seen as country's 1st attack by sympathiser of terrorist group Islamic State.,,,
"Excellent. There is no First Amendment right to smash windows, commit arson, block streets, throw bricks at police,…",,,
"a blog post I wrote a while ago, so sad to hear the DAPL pipeline has been given the go ahead again! #NoDAPL",,,
"Forget vikas, forget notebandi. Here in West UP, it is raw appeal to religion dominating politics. I report,",,,
Sunderland's #Senegal defender Djilobodji will miss the next 4 matches after being found guilty of violent conduct.,,,
Villagers in India have been busy knitting elephants jumpers to protect them from the cold. (Photo by Roger Allen.),,,
"Civil Defense, Peace Corps battle in Osogbo RT",,,
Defeat and Destroy ISIS & Islamic Jihadists | American Center for Law and Justice,,,
Calgary Mom Found Guilty of Negligence After Letting Her Son Die Instead of Taking Him to a Doctor,,,
"RAS 2016 Mains Exam has been postponed due to Hon'ble Court's decision on SBC reservation ( dated 9/12/16, 1645/2016 ) #rpsc #ras2016",,,
Edo-Osagie flays Ikimi’s call for zoning of 2019 presidential ticket to South @,,,
"Converted Hindus, engineers among 52 ISIS terrorists held by NIA",,,
"A major police operation has blocked off Ipswich streets as officers swooped, raiding two properties. #9News",,,
"At the Georgia mobile home park where 7 people died, mayor says storms left behind what looked like a bombing scene…",,,
"Drama, Gossip, cold war a perfect package entertainment #EatSleepBB10Repeat #BB10Finale on Voot Coming soon",,,
#BoycottFoxSports until they fire Blackburn! Bullying kids will NOT be tolerated!,,,
From tornado damage survey team: Structural damage in southwest Hattiesburg.,,,
@DHSgov this is all about lining his pockets w taxpayer money. But stock in Israeli Co. Magal. They're getting the contract,,,
Biafra: Killing (Bombing) Of 236 Citizens In Borno IDP Camp: Nigerian Government Has Breached The Geneva……,,,
Opposition tell regime in Astana until u tell foreign shia militias to get out of Syria then don't talk about JFS,,,
Family pay touching tribute to 'bright bubble of joy’ killed in horrific Melbourne car massacre…,,,
#UPDATE || Olivia did a livestream about her post with Freddie. It was for his first birthday and she got permission from Briana,,,
Report: James Comey to Remain FBI Chief Under Trump Administration,,,
"55% of US lives in a Clinton county, 47% in a Clinton House district. Important for when some say geography matters…",,,
Please keep my former teammate in your prayers tonight. Payton is in the ICU after receiving a dangerous hit in his…,,,
Fire meets ice at #Sundance. This life-size sculpture is equipped with LEDs to demonstrate the #NSX's Sport Hybrid…,,,
"Do you recognize them? If so, contact Det. Eastman 714-990-7638. They are connected to a recent stabbing. More info…",,,
Toxic croquettes are sold in France! Force the authorities to analyse them and make public the results!…,,,
I held a bilateral discussion with the Foreign Minister of Egypt this afternoon. Egypt is an important partner in s…,,,
Hopes and prayers are with the injured and frightened. Who in their right minds thinks shooting unarmed cops is a w…,,,
lopa's fan please vote for Rohan.... Please please please,,,
"Latoya Rule is campaigning for justice not only for her brother, but all blackfellas who have died in custody",,,
What Do They Want? Graeme Wood Speaks With Supporters of ISIS a review of @gcaw's new book,,,
We're in Daytona right now. Stay with @WESH as this volatile weather system continues to move through Central Flori…,,,
Greenbelt Metro off I-95 parking lot is full-do not park on shoulders! Your vehicle could be ticketed/towed. Check WAMATA 4available lots,,,
"Alvarez wrestlers pushing the envelope, pose threat to powerhouse Gilroy: Salinas When Riley Siason transferred……",,,
"Those jeans are bomb af, chad probably wears polo shirts he needs to take several seats",,,
The year is 1962. The world is on the brink of nuclear war. The USA & USSR agree to relinquish all weapons & resolve conflict with Yu-Gi-Oh!,,,
"Estonia still least corrupt post-commie country, 11th overall in EU. Western EU: it's time to end the shameful, fac…",,,
There's a very special episode premiering on Sunday at 9. Closest one to our hearts so far. Rebuilding after the flood. Please join us. DIY,,,
"Vaping products aren't a danger to public health, they're a danger to Government, Health, Pharmaceutical & Tobacco control's #fiscal health""",,,
"Steven Adams confirmed Kanter is ""still alive"" before talking about him and the injury for a couple minutes:",,,
NYC Women's March happening now along 2nd Avenue in Midtown #ABC7NY #WomensMarch,,,
"Nigeria: Police officer arrested for allegedly kidnapping and selling baby for N600,000 By Adeola Opeyemi @naijcom",,,
"See the pictures of Cameron and other ""sportsmen"" shooting this weekend. In case there was any doubt.",,,
"When a majority of the voting population is female, get used to government policy being guided by tearjerker images of crying kids.",,,
"BREAKING: Cleveland Browns trying to find this protester who threw a rock through Starbucks window with ""Incredible…",,,
.@realDonaldTrump lies about his relationship with Putin and his Russia ties are under investigation. We deserve an…,,,
"Terrible news! UTEP player, 6 others indicted in bank fraud via @elpasotimes",,,
"Texas Mall robber SHOT by civilian, accomplice escapes, 6 others shot - The Right Scoop",,,
President Trump: Women aren’t going back to second-class citizenship. They are going forward. We are all in this together.,,,
"Kremlin-financed RT pays for carriage w/ Dish, Comcast & Charter, & has latched on to must-carry broadcasters",,,
"Anyone else remember the mass #voterfraud that happened in Broward County, giving Hillary almost 100,000 more votes?",,,
"In Defense of Broken Windows, Property Destroyed, & Limos Set on Fire via @@JohnLaurits",,,
rrawaddy dolphins being killed in record numbers by gangs who use car batteries to stun aquatic life.,,,
"In ""Joe's Violin,"" nominated for an Oscar, a Holocaust survivor donates his violin to an instrument drive…",,,
"Tesla’s crash rate dropped 40 percent after Autopilot was installed, feds say",,,
"The 2017 NBA East All-Star game reserves are: Isaiah Thomas, John Wall, Kyle Lowry, Kemba Walker, Paul George, Paul Millsap, Kevin Love",,,
"Update: Police say only 1 person has died. Medical personnel are trying to revive the 2nd victim as of 4 p.m., an A…",,,
"chungha's so clingy when she's with nayoung, very cute with yoojung, hyper with somi or doyeon but very scandalous with sejeong.",,,
This is Wyatt. He's got the fastest paws in the West. H*ckin deadly. 11/10 would ride into the sunset with,,,
Police have unchecked hive-mind authority and motivation to overstate protest risks to public safety so they can collect overtime checks.,,,
someone said dara is currently in PH shooting for MMK so was luis's comment actually a hint? #socomode,,,
7 years after coming from bloody Civil war in SL - maybe this would connect some ideas on the ideas of revolution. Just a dif perspective.,,,
"Parakeelia, Privacy, And The Need For A Federal Anti-Corruption Body - New Matilda -",,,
Amazing #Eagles__ held Falcons to their fewest points this season (15). Only team to hold them under 23. Matt Ryan's…,,,
2016 was the best year for the US housing market since the financial crisis,,,
Montreal woman who spent 6 months in solitary sues federal government,,,
"SALGA will on Tues, 24 Jan, 10am, meet with Min of Public Enterprises & @Eskom_SA Board to discuss the Eskom Munici…",,,
Bill would make hazing at New Mexico schools a crime,,,
This woman was probably fire from The gurdian seconds after making this public #gamergate,,,
"EpiPen competitors appear to be having an impact, per Evercore ISI $MYL $IPXL",,,
a democratically elected candidate being sworn in is as scary as a terrorist attack that killed thousands of people…,,,
Deputizing local police officers to enforce immigration laws means a lot of crime victims & witnesses will not be calling cops/cooperating,,,
Malia Obama joins Dakota Access pipeline protest at Sundance,,,
Our first crew of #WomensMarch volunteers are kicking off the labor delegation at 1st and F St. #1uWomen,,,
"AL-SHABAAB MILITANTS attack KDF camp at Kulbiyow, Somalia today morning; number of casualties unconfirmed.",,,
"Police, firefighters, schools join Pink Shirt Day across BC... #BritishColumbia",,,
Silicon Labs Makes Internet of Things Grab with Zentri Acquisition - Electronics360,,,
"Eric Garner, Michael Brown, Philando Castile, Laquan McDonald, Alton Sterling: all these men are Louis Tills",,,
"‘The Girlfriend Experience’: Anna Friel, Louisa Krause, Carmen Ejogo Cast in Parallel-Storyline Season 2",,,
"I just voted on @myvotetoday’s poll ""Who is the Most Corrupt CONgr..."", have you? Voting closes in 22:33 hrs.",,,
Wall St.'s elation turns to concern after Trump's first bizarre weekend,,,
People that use racist social media posts to expand on structural racism in SA are saying people are taking advantage of homophobic sermon.,,,
#BPS investigating a stabbing overnight-20yr old Barrie male taken to RVH with non life threatening injuries.Further info to be released.,,,
"Tories write off stoke-on-trent central by-election, party sources say # via @HuffPostUKPol",,,
"Due to a sinkhole, Edgecombe Ave is closed from W 165th St to W 170th St in Manhattan. Expect emergency personnel & use alternate routes.",,,
"Slavery, Native Genocide & Women's Rights were 'a few hiccups' along the way to making Amerikkka great",,,
"Yes! Never lose sight of that! I did enjoy the LGBTQ dance party protest outside Pence's house...his policies, tho.…",,,
Thank You Brit. We deplorables suspected this. Fox has to decide If they are going to go along/w Fake MSM narrative…,,,
Lawmakers Introduce Bill Restricting Use of Nuclear Weapons Dumb bill as we all be dead by the time is approved,,,
The Cathedral's great bell is half muffled tolling as a sign of mourning for those killed in Bourke Street prior to…,,,
It's okay to regret voting Buhari without regretting voting out GEJ. They're not mutually exclusive. They're both colossal disappointments,,,
French Socialist Presidential Candidate Wants Tax On US Imports If Paris Agreement Suspended,,,
Historian’s Latest Book on Mao Turns Acclaim in China to Censure,,,
"Ahmed Kadar: In 2017 elections, let us vote on basis of issues not tribe or leadership. We are all Kenyans…",,,
Review: The Flame in the Flood | Pure PlayStation #N4G,,,
Yesterday Trump's opponents were demanding an investigation. Today they're trying to poison the well against it.,,,
From FB-Wendy Latour Not racism-genuine concern of Cdns people trying to impose their way/will to take over Canada…,,,
Wildfire smoke plume noted on Radar in a rural area north of Skiatook Lake in Osage County. #okfire,,,
Trump's Wall Could Cause Serious Environmental Damage via @instapaper,,,
Traffic Alert: I-75 SB in Madison Co at the 87 mm is closed due to a crash involving a semi truck. Pls expect delays.,,,
Ninth person dies due to Vic storm asthma -,,,
Senator Abdullahi Gumel thanks President @MBuhari for the #2017Budget. He speaks on the need for functional LG administration and Housing.,,,
She has about as much credibility as Sean 'The Spoofer' Spicer,,,
"Contact Senator Mcguire of California - Legalize Cannabis. Save Money, Increase Voluntary Taxes....",,,
"The Independent Corrupt Practices and Other Related Offences Commission (ICPC), is to arraign some government…",,,
Guns & domestic violence are a deadly combination. The presence of a gun in a domestic violence situation makes a d…,,,
Police has taken JanasenaActivist Sandeep @sandysayz into custody&not even revealing his whereabouts #APDemandsSpecialStatus #ShameOnAPGovt,,,
We're having a blast #CNSA2017! Speaking up for Canada's nursing students & health care #BellLetsTalk,,,
BCBtigers : Take a look on most run scorers and wicket takers for Bangladesh in the last s…,,,
Chuck Schumer Slammed Vet and Senator Tom Cotton over Inexperience That Blew Up in His Face,,,
One of the most toxic lies in American politics is that civic virtue & private virtue can be divorced.,,,
Nigeria botched air strike may have killed up to 236: official #Rann #Borno,,,
"Dilliwalahs dont understand culture, problems of Punjab, Badal Senior tells me in a rare interview before polls",,,
"When Joe Arpaio was a well-known Arizona sheriff, he could duck out the back door of the courthouse. Not anymore…",,,
"The 6'9"" 320 pound tackle from Auburndale has verbally committed to play with the UT-Martin Skyhawks of the Ohio Va…",,,
Are You A Better Shooter Than You Think? Proper Barrel Support How To Shoot Awesomely | TruthNation,,,
"BJP targets Kannur, hotbed of Kerala violence, after RSS worker’s death",,,
The Perfect Storm Facing Black Men on HIV,,,
Animal welfare group caring for 100-plus puppies rescued after delivery van crashes in NY.,,,
"JUBILEE wants to buy this air tractors for 43.4 BILLION from America,While doctors are on Strike #UhuruTenaGarissa",,,
"Trump may find kindred spirit in India's Modi, another tough-talking nationalist",,,
Arizona State Trooper Shot by Former Mexican Police Officer Illegal Alien,,,
"Hi Mayors! We're adjusting the prices of Fire, Police & Health buildings to give you a smoother and more dynamic ex…",,,
An off-duty Sunbury officer is being called a hero tonight after stopping to help drivers during the tanker fire.…,,,
"Lizzie and Jeremy talking about the Infinity War's production, I'm saved",,,
Paris Decided To Drain This Canal What They Found On Its Surface is Shocking,,,
People try to make the KKK relevant for the sake of justifying a racist organization like BLM. The KKK has less tha…,,,
60' Dyer bursts into the Cardiff City box but Connolly times his tackle well to thwart the danger. #CARBUR,,,
"Lake Effect Snow Warning in effect from Thursday afternoon in Cattaraugus, Chautauqua and Erie Counties #nywx",,,
The far right on the US is already preparing to campaign in France for Marine Le Pen,,,
The president suggested imposing martial law on Chicago because he saw a segment about it on Bill O'Reilly's show.,,,
Leicester city will be praying&hoping Algeria gets knocked out of Afcon soon. Mahrez&Slimani back in the team will help relegation battle.,,,
Laadlo ko pahucha diya final me without voting shame on u bb Rohan For Finale,,,
Met Office warning of icy roads and pavements across Sussex,,,
"Grayson teammates, top DB Deangelo Gibbs (enrolled at #UGA) & priority target DB Jamyest Williams (on an OV), pose…",,,
War Room has exposed incompetence of Kay Sexwale as a media Strategist. The results u get when a Cadre is deployed.,,,
Economic offences wing of finance ministry finds Kejriwal's brother-in-law Surender Bansal guilty for submitting fa…,,,
"In Illinois, @AndyPuzder's stores move hours to different pay periods so they don't have to pay overtime.…",,,
