Tweet Text,label (annotator1),label (annotator2),label (annotator3)
California Gov. Brown takes defiant tone in state-of-state speech,,,
Intel agencies have been probing contact between Gen. Flynn & Russia for 5 months. Read more:,,,
The UK Supreme Court just ruled that Theresa May can't force Brexit without a vote by Parliament. Good. Now let's get some checks on Trump.,,,
Extraordinary moment Theresa May refuses to say four times whether she knew about Trident 'cover-up',,,
"Trump may suspend some immigration from Iraq and 6 other nations, either temporarily or ""indefinitely,"" sources say…",,,
Toronto police apologize for AIDS comment made by officer in arrest video,,,
"5,000 US troops currently embedded with Iraqi forces. Even loose talk of plundering Iraqi wealth is dangerous.",,,
"Elon Musk is pressing Trump to adopt a tax on carbon emissions, offical says",,,
"Michael Moore speaks at the #WomensMarch: ""Mr. Trump, we are here to vow to end the Trump carnage""…",,,
".@KellyannePolls: Barack Obama, Hillary Clinton ""conspicuous by their absence"" in yesterday's Women's March…",,,
How white working-class voters in the Midwest helped propel Donald Trump to victory,,,
SD Republicans move to kill voter-passed ethics reforms,,,
BREAKING: Turkish military says it killed 65 #ISIS militants in Syria on Sunday,,,
"Chicago welcomes U.S. help on violence, but balks at National Guard after Trump tweet",,,
"Breaking- JPSO: Sylvester Holt, suspect in murders of Officer Michael Louviere, Simone Veal & her unborn child, pronounced dead last night.",,,
US sues JPMorgan for alleged mortgage discrimination,,,
"McCain, Graham say they will support Tillerson for secretary of state",,,
The chances of being killed in a terror attack by a refugee? 1 in 3.6 billion a year. Via @USATOpinion.,,,
2) Syria will remain a unitary state with centralized government. Kurds will get an autonomy within it (think the Basque country in Spain),,,
"View from The Eiffel Tower of the 'Women's March' in Paris, France. Credit: @nature_seen",,,
"China is becoming 'increasingly risky' because of its economy, Goldman Sachs analyst says.",,,
"If America had a parliamentary system, Trump would already be facing a vote of no confidence",,,
Death and devastation in Georgia -- and it could be a long and dangerous night across the Southeast.,,,
"La La Land leads #OscarNoms charge with 14, equalling record of All About Eve & Titanic",,,
Trump reverses abortion policy for aid to NGOs -,,,
Duterte pleads with Philippine rebels to rebuff #IslamicState advances,,,
What went wrong with the European left? Ask France.,,,
"Why are pads and tampons still taxed, when Viagra and Rogaine is not? Actress @AshleyJudd at the #WomensMarch.",,,
Canceled Trump-Peña Nieto meeting marks biggest U.S.-Mexico rift in decades,,,
San Diego Zoo keepers are hand-raising a Rodrigues fruit bat after delivering it by C-section.,,,
"Luke Bryan to sing the National Anthem at Super Bowl LI. ""See y'all in Houston.""",,,
Trump administration freezes EPA grant programs: reports,,,
Greenpeace literally brought Marco Rubio a spine to mock his vote for Rex Tillerson,,,
"Pennsylvania man beats, chokes mom for changing channel, police say via @NBCPhiladelphia",,,
Of course Trump __InfoWars. Alex Jones is a fake conspiracy theorist 4 just like POTUS is a fake nationalist 4 votes. And both are crazy.,,,
"Royal Mail will dedicate a full set of stamps to David Bowie, a first in celebrating a single musician",,,
1. Thread on how Putin via Assad forced refugees into Europe then weaponized situation to break EU @NikkiSamuel,,,
"#WomensMarch attendees shout ""Shame!"" as they pass Trump's DC hotel:",,,
Even people in Antarctica joined the Women's March movement,,,
NASA has a bold plan to save Earth from killer asteroids,,,
"Trump forms manufacturing council including Musk, CEOs of Ford, GE",,,
"Dallas High School Teacher Posts Video ""Shooting"" Trump With Squirt Gun In Classroom",,,
Michael Moore Rips Trump Inauguration Front Page at DC Women's March,,,
"Ungrateful TRAITOR Chelsea Manning, who should never have been released from prison, is now calling President Obama a weak leader. Terrible!",,,
"Hamilton tickets used as lure in massive Ponzi scheme that bilked investors out of millions, complaint says…",,,
Pride of lions brings traffic to a standstill in South Africa as they devour a buffalo they have just killed…,,,
"Holy crap: Pedro saying Yordano Ventura survived the car crash, but those who found him robbed him and left him for…",,,
WATCH: Surveillance video captures violent crash involving school bus in South LA,,,
"These #WomensMarch participants travelled to Washington D.C. from all over the country: Rhode Island, N.C. + NYC…",,,
Mexican president cancels U.S.A. visit over wall comments. #SpecialReport,,,
House Speaker Paul Ryan: “We are on the same page as the White House”,,,
Did an earthquake shrink Mount Everest? India is going to check.,,,
TPP withdrawal marks start of new approach to global trade that threatens to distance US from some Asian allies…,,,
Lawmakers show solidarity with #WomensMarch on Washington,,,
Arrest warrant issued in Brazil for a tycoon as a corruption investigation expands.,,,
VICTIM OF VIGILANTES: Torched inauguration limo belonged to Muslim immigrant; damages totaled $70k,,,
"Actress Kristy Swanson stands up against Chelsea Handler after the comedian attacked Melania, saying ""she can barel…",,,
Attack on Alt-Right Leader Has Internet Asking: Is It O.K. to Punch a Nazi? -,,,
Zoos across the U.S. participated in #cuteanimaltweetoff because hope is not dead,,,
"McCain, Graham & Rubio all strutted around to plaudits expressing Grave Concern over Tillerson's Russia ties. All will vote to confirm him.",,,
"LeBron James on the questionable player voting for the All-Star game: ""There's always goofy votes. Donald Trump is our president""",,,
These Trump supporters were horrified to learn their hats weren't made in America,,,
This is nuts. Aetna withdrew from profitable ACA exchanges to punish Obama Administration politically.,,,
"3:59AM: Particularly Dangerous Situation: CONFIRMED tornado located near Nashville, GA, moving northeast at 35 mph.",,,
U.S. stocks kick off week on a cautious note. Dow loses 10 points. S&P 500 and Nasdaq are flat.,,,
Wow. A look at the massive crowd at Shady Grove Metro Station in Maryland as people make their way to #WomensMarch…,,,
State Department resettles 500 refugees in last 24 hours as Dems delay Rex Tillerson confirmation,,,
"Apple joins Amazon, Facebook, Google, IBM and Microsoft in AI initiative by @romaindillet",,,
"Size of DC #WomensMarch today & ongoing flak by Dem-press, Soros, CIA, etc, show Trump in for Korea-like protests",,,
"Bernie Sanders: ""The great political and democratic crisis we face...is not voter fraud, it is voter suppression""…",,,
Qualcomm stock takes a sharp hit on heels of Apple and FTC filings,,,
Chile battles devastating wildfires as international help pours in,,,
"Hear Charles Lloyd & The Marvels take on Bob Dylan's blunt protest song ""Masters Of War"" with Lucinda Williams.…",,,
Cecily Strong and Sasheer Zamata paid tribute to Barack Obama with a rendition of 'To Sir With Love.' #SNL,,,
Lifting Russian sanctions on the table for Trump-Putin call -,,,
Dem bill would ban Trump from launching nukes without declaration of war by Congress,,,
Trump names new head of agency in charge of his DC hotel: report,,,
"Dem lawmaker blasts Trump's immigration order: ""I'm ashamed' he's our president""",,,
Trump’s DC hotel lost over a million dollars in its first two months,,,
"NEW VIDEO: Gov. Dayton collapses during State of the State. Son, Eric, says he's ""doing great.""…",,,
Rigged election: Donald Trump won every surprise swing state by the same 1% margin via @PalmerReport,,,
Florida braces for storms after 18 people die in Georgia and Mississippi,,,
Federal judge blocks Aetna-Humana health insurance megamerger,,,
Afghans hope and worry that Trump will shake things up,,,
"Dear @NBCNews, showing a Sikh man under headline about ""radical Islamic terrorism"" will add to more ignorance about…",,,
"Peyton Manning talks teamwork, leadership at GOP retreat",,,
Outraged Mexicans back Peña Nieto's decision to scrap visit with 'bully' Trump,,,
"Paul Ryan: Building Mexico border wall ""urgent""",,,
"Reps. Cummings, Brady, and Clyburn have sent letters to election officials in all 50 states + DC, request proof of…",,,
Trump administration corrects error on Trump's margin of victory in White House website bio,,,
Top Trump White House staffers have active private RNC emails,,,
.@newtgingrich: The false report of the MLK Jr. bust being removed from Oval Office is part of underlying effort to…,,,
"According to official police estimate, crowd at Women's March in Seattle today was 130,000. Largest in Seattle history, by a big margin.",,,
A new documentary claims that a fire might have contributed to the Titanic’s sinking,,,
Textron buys snowmobile maker Arctic Cat for $247M,,,
Authorities say a 14-year-old girl broadcast her death live from the bathroom of her Miami area foster home.,,,
DC hotels did better weekend business for Trump Inaugural than Obama,,,
Police ID suspect in shooting at Chef Menteur gas station,,,
"One killed, 5 hospitalized after San Antonio mall robbery 'gone really, really bad'",,,
U.S. tax reforms could 'transform' global oil market: Goldman Sachs,,,
"LA Mayor Eric Garcetti: We think Trump's demand is ""unconstitutional and un-American""",,,
The Coen Brothers made a new Super Bowl ad for Mercedes.,,,
Veteran journalist Mark Halperin has left Bloomberg Politics,,,
Sen. Ben Cardin says he will not support Rex Tillerson’s nomination for secretary of state,,,
It's a medical mystery: A cluster of patients in Massachusetts were struck with rare amnesia,,,
"As soon as Jennifer Weiner found out that there would be a Women's March to oppose Trump, she was in…",,,
"Trump resigns from businesses, leaves sons, CFO in charge",,,
"These girls are on fire, sings Alicia Keys while walking the stage at #WomensMarch rally",,,
Reality check: Many of Trump’s early vows will never actually happen,,,
DANGEROUS: NKorea Defector Says Kim Jong-Un Control Crumbling...,,,
#WomensMarch on the move in downtown Austin (KXAN Viewer Video/ Mark Stratton),,,
Penguins for Peace: There was even a Women's March in Antarctica,,,
Senators Join Stage at Women's March for Message of Solidarity,,,
"Read early reviews for ""T2 Trainspotting,"" a sequel to the film that gave a glimpse of Edinburgh’s seedy underbelly",,,
GOP Senator calls for investigating what the FBI did about Russia-Trump intelligence,,,
Experts Say Trump's Trans-Pacific Partnership withdrawal could hurt farmers across the U.S.,,,
"Today's Google Doodle honors Bessie Coleman, the world's first African-American woman to earn a pilot's license…",,,
Mexico's president will be among the first foreign leaders to meet with Trump this month,,,
Aaron Richard Davison arrested for hit and run crash that left cyclist dead on road to be found by mother…,,,
"Alaska volcano erupts again, sending up another ash cloud.",,,
"Shot At The Back By Army, Bleeds From The Mouth, Watch Young Defenceless Biafran At Trump Rally In P'Harcourt Suffe…",,,
"Foreign Terrorist Entry Executive Order, from the White House:",,,
Pictures from Women's Marches from the U.S. and around the world #WomensMarch,,,
Oil slides as US drilling recovery outweighs OPEC-led cuts,,,
Russians Charged With Treason Worked in Office Linked to Election Hacking -,,,
Why is Taylor Swift’s tweet about the Women’s March so controversial?,,,
Former Mexican President Vicente Fox is not Donald Trump's biggest fan:,,,
"Residents in Long Beach, California seen kayaking through flooded streets as record rainfall causes extreme floodin…",,,
"Gag order, schmag order: The Badlands National Park Twitter account went rogue with tweets about climate change",,,
"#BREAKINGNEWS: San Bernardino Mountains restricted to residents only, CHP says. People urged to avoid area including the 330, 18 and 38",,,
Trump supporters and neo-Nazis are using secret chatrooms to harass Shia LaBeouf,,,
"Breaking: Mexico's President Enrique Peña Nieto cancels upcoming trip to Washington, D.C. to meet with President Trump.",,,
"Ungrateful TRAITOR Chelsea Manning, who should never have been released from prison, is now calling President Obama a weak leader. Terrible!",,,
"Pipeline breach southeast of Regina leaks 200,000 litres of crude oil",,,
Rand Paul announces Obamacare replacement plan,,,
"EU is about to vote on assault weapons ban on Thursday, Jan 26th. Pt to Paris &Copenhagen terror attacks,but bill wouldn't have stopped them",,,
President Donald Trump's refusal to let sleeping dogs lie now threatens to harm his presidency…,,,
"Parts of the Danube River in Austria have frozen solid, drawing dozens of locals to skate and play ice hockey on it…",,,
"Canadian PM Justin Trudeau tweets in support of yesterday's Women's Marches: ""You keep your government inspired.""…",,,
Senate Intel panel agrees in closed session to move forward with committee investigation into Russian election acti…,,,
A British businessman has been shot dead while sitting in his Porsche in the Thai resort town of Pattaya,,,
EXCLUSIVE VIDEO: Police arrest and Taser suspect after female cop allegedly assaulted,,,
"Bankers generating 20% of HSBC's London revenue may move to Paris, CEO says",,,
"Donald Trump's Mexican import tax would affect avocados, chili peppers and beer",,,
Staffing cuts left area of Fort Lauderdale airport shooting unguarded:,,,
France’s neighbors sound alarm over the election's risk of catastrophe for the EU,,,
"As Trump targets immigration, 2 million criminal noncitizens already inside US via…",,,
Update: The New Zealand government is now investigating how Peter Thiel gained citizenship in the country…,,,
People in California are pushing to leave the USA. If #Calexit happens that's fine! Republicans will never lose ano…,,,
Fox News' Tucker Carlson nearly doubling Megyn Kelly's primetime ratings,,,
"If wall might cost $12B-$15B, that money could fund EPA for almost 2 years, IRS 8 months, buy 150 F-35 fighters:",,,
"Star Wars: Episode VIII to be titled ""The Last Jedi""",,,
Hannity 'Hopeful' President Trump Will Do Everything He Says He'll Do,,,
Boston march estimated at 120 to 125k. That from senior police official. Organizers were initially planning for 25k,,,
"Grant County, Nebraska has the highest rate of Obamacare enrollees in the US. It also voted overwhelmingly for Trum…",,,
"#UPDATE: People asked to leave CBD, after light plane crash which claimed 2 lives cancels #skyworks2017. Estimated 300,000 people to attend",,,
Duke coach Mike Krzyzewski is not happy with the Blue Devils.,,,
"South African police seize 5,000 donkey skins in Benoni farm raid",,,
Buyer's Remorse: Only 26% Of Americans Would Vote For Obama Again - Rated Worst President In US History @Derameth,,,
Trump accusers join #WomensMarch on Washington,,,
"Speaker Ryan on Trump's wall: ""We're going to pay for it and front the money up""",,,
Bucks’ Jabari Parker benched for violating team rule by discussing locker room matters with the media…,,,
"Dean Baquet vs. Gerard Baker. Baquet's paper says this was a ""lie,"" Baker's paper says it was an ""unsupported claim""",,,
But Madonna goes live & without a delay. And people wonder why only @CNN's ratings have gone down after the electio…,,,
"UK Prime Minister Theresa May: The UN is ""in need of reform,"" but it is still vital",,,
"What Trump has done in 2-days, Buhari has not done in 2-years - Nigerians React venomously to Hurricane Trump",,,
"Democrats have lots of reason to be pissed at Comey. But if he leaves the post, Trump will be able to select his ow…",,,
Trump's top defense and homeland officials to attend Munich Security Conference,,,
Powerful 7.9 earthquake hits Solomon Islands,,,
"Madonna & Ashley Judd stirring the pot of liberal racism, hate and division. That seems to be the Democratic Party way.",,,
New Medical Worry: Deadly Fungal Infection That Resists Treatment,,,
"A tweet about deaths in Georgia due to severe weather has been deleted because the affected area is in southern, not central, Georgia.",,,
"Madeleine Albright is ""ready to register as Muslim"" in solidarity",,,
"Ford, Lockheed Martin CEOs get more #Trump time at White House",,,
"Pennsylvania teacher resigns after police say he drove drunk to work, crashed car at entrance of a high school.",,,
"Hong Kong, Sydney and Vancouver top a survey of the world’s least affordable home markets",,,
So many people turned out for #WomensMarch in Chicago organizers canceled plans to march through city’s downtown…,,,
"Listen to new songs from Arcade Fire, Gorillaz, J. Cole and others",,,
Under @BarackObama more Americans died domestically by lightning strikes than by terrorism and he didn't have walls and useless #MuslimBan,,,
"A lot is on the line for hospitals if Obamacare is repealed -- more than $160 billion, by the AHA's estimate.",,,
The Astana peace on Syria talks will fail with out the invitation of Kurds. The Kurds have shown their heroism and…,,,
.@POTUS: “A lot of plants are going to be built in Michigan & Ohio & North Carolina & Pennsylvania and I’ve only…,,,
Kara's Rada force in Tripoli says has identified perpetrators of car bomb near Italian emb & claims they have links w/ Hiftar's Op Dignity,,,
Snow-covered buildings collapsing in rare US West weather,,,
Brexit and Trump shocks could make Canada a hot destination for M.B.A.s,,,
Poland's Defense Ministry says 2 US soldiers have been hurt in an Army truck accident in southwestern Poland.,,,
"Ahsan Untoo, a human rights defender was tortured ruthlessly by Indian police in #Kashmir on #GawKadalMassacre aniv.",,,
Government agencies banned from tweeting under the Trump administration by @kateconger,,,
Oil Producers Claim Progress in Curbing the World’s Daily Supply,,,
Manhattan jail that holds El Chapo is called tougher than Guantánamo Bay,,,
We're in more danger with ourselves than the bad guys.' Toronto officer shares battle with PTSD #BellLetsTalk…,,,
"Mexico has taken advantage of the U.S. for long enough. Massive trade deficits & little help on the very weak border must change, NOW!",,,
"Sen. Lindsay Graham to Trump: Stop saying ""illegals"" cost you popular vote",,,
Authorities in Lebanon say they have thwarted a suicide bombing in one of the busiest neighbourhoods of Beirut…,,,
"J.P. Morgan, Intuit give Mint, TurboTax customers wider access to bank data",,,
Japan finally gets a champion in its Mongolia-dominated national sport of sumo,,,
Fears terrorists could take advantage of political crisis in Northern Ireland after a police officer was shot,,,
Pope warns that rising populist movements could produce a new Hitler,,,
Medicaid takes center stage as Democrats grill Tom Price -,,,
BREAKING: Authorities release sketch of man believed to have pulled fire alarm at Steelers hotel this morning. Poli…,,,
A first look at the path NASA astronauts will walk when the U.S. launches humans into space again,,,
.@seanspicer won't answer whether #Trump will rescind Obama exec order banning LGBT discrimination among fed contractors #pressconference,,,
"Republicans to kill U.S. rules on corruption, environment, labor and guns next week via @YahooNews",,,
here’s a great overview of why Trump’s twitter is a potential (inter)national disaster by @Bernstein,,,
Trump's draft executive order asks for review of America's methods for interrogation of terror suspects.,,,
"Tell that to women in Libya, Iraq, Syria, Pakistan, Yemen, Palestine, Honduras—Clinton's warmongering list goes on..",,,
"Sunday Times claims Downing Street covered up Trident missile test failure of its nuclear weapons system, weeks bef…",,,
Oxford Economics study: just about all of the states that would be hurt the most in a trade war voted for President…,,,
Berlin's mayor just issued this message for Donald Trump. It's quite something.,,,
"St. Paul police now estimate as many as 100,000 people attended the Women's March Saturday. |",,,
BREAKING: Russian Defense Ministry says its warplanes have flown first combat mission in Syria with U.S.-led coalition aircraft.,,,
"Fox ""News"" cans Stacey Dash, who somehow fell short of their journalistic standards. This is like being kicked out the Klan for intolerance.",,,
"Jeremy Corbyn expressed #pmqs condolences to family of ""police officer who lost his life"" in Northern Ireland... but he's still alive.",,,
The next generation of Democratic Party leaders took to microphones at the Women's March events,,,
Ethicists say President Trump is improperly profiting from his office.,,,
"Under Trump and Pence, optimism soars for March for Life participants",,,
People are leaving their Women's March signs outside the Trump Hotel,,,
Trump taps private-equity investor as civilian head of Navy,,,
"VARNEY: If Pres. Trump's economic policies are successful, Democrats up for re-election better get behind him or th…",,,
"#Hurricane Matthew Destroyed 177 Miles of East Coast Dunes, USGS Says:",,,
Ft. Lauderdale airport shooter is indicted on 22 counts and now could face the death penalty,,,
At least 1 dead after small plane crashes at Tucson airport,,,
Arthur Blank taking nearly 500 Falcons employees to Super Bowl LI:,,,
Essentially WH PressSec Spicer is accusing the media of Majestätsbeleidigung regarding their coverage of the inauguration. This is crazy.,,,
Police charge driver in Australia rampage with five counts of murder,,,
The first train to cross Aleppo in years traverses an urban wasteland,,,
"Sean Spicer claims the media inaccurately reported crowd sizes, but video footage suggests otherwise.",,,
The life of a New York City Ballet corps dancer,,,
"6 people were shot in Chicago including a 12-year-old girl at a memorial for a gunshot victim, when will this stop?",,,
"Y'all better not think Peña Nieto is cute for ""being against Trump"" and forget he has killed students, protesters,…",,,
Nigeria's recession is creating opportunities for Africa’s largest bank,,,
British PM May announces Pres. Trump has accepted an invitation from Queen Elizabeth to make a state visit to the U…,,,
"Kellyanne: “Sean Spicer...gave alternative facts” Chuck: ""Alternative facts are not facts. They are falsehoods.”",,,
Hedge funds are showing they have some faith in OPEC by betting on rising crude prices,,,
Analysis of Women's march. Cops performed ADMIRABLY under the circumstances. Shame on the D.C. Metro Police Chief. His cops were undermanned,,,
"The [Dakota Access] pipeline has the possibility of affecting 18 million Americans water supply, says…",,,
Border tax ideas roil oil markets and favor Gulf Coast refiners,,,
NEW ERA OF TURMOIL: select @LATimes pages on the Women's marches and the first full day of the Trump administration.,,,
ZERO Americans have been killed by foreign nationals from the seven countries from which Trump banned immigration.,,,
Florida woman charged after police say she hit an officer with a tampon. #odd,,,
U-Va. president Teresa A. Sullivan announces she will step down in summer 2018,,,
Trump was not kidding when he said he will blow ISIS into bits and pieces. The General destroyed 31 ISIS targets h…,,,
Pres. Trump's nominee to lead Health and Human Services is back in the spotlight for another round of grilling…,,,
The Latest: White House says the Trump administration will keep dialogue open with Mexico.,,,
".@OReillyFactor: “In Chicago, where the mayor cannot control gang violence, he remains defiant on criminal aliens.”…",,,
Senate’s investigation into alleged Russian hacking begins without end in sight,,,
"@womensmarch Guess what? I'm a woman & voted for Trump. How dare you call me a victim. I'm not of the poor"" me mentality of Dems.",0,,
"Hello, my name is Donald Glover. You killed my father. Prepare to die.",0,,
"Yes, I have contacted my MPP for ON's 'cap n' tyranny' tax & two MP's about PMJT's proposeed carbon tax & his spend…",0,,
"Congratulations sir, Mr. President, I am no longer ashamed of the USA! My prayers are with you.",0,,
"Nadine is a non-conformist. She paves her own way and refuses to be caged-in to PH showbiz' standards. You do you, Bangsie! #ScoutXNadine",0,,
"This sweet little guy was found near Blackhawk Road in Eagan tonight, let me know if you recognize him. Please shar…",0,,
"Devastating. I have news for you, Liz. The jets that transport you on your taxpayer financed vanity trips don't…",0,,
I'm supposed to call my Senator about Zinke being a terrible choice for Sec of Interior. (he is) Guess who is my Senator? Yep.,0,,
"I wish President's parents were here to witness this historic event. Son, You have made your father & mother very proud.",0,,
"I left Chicago's protest after a couple hours. If anyone has accounts of police harassment, send it my way.",0,,
"Hey @AnissaNow, I was looking for a nice shot of Bolotnaya to compare w DC riots and found this. You know this is a…",0,,
"if one of your personal safety concerns is that antifa might attack you, you have made bad choices in life",0,,
This is the man that sent me to a Harley Street psychiatrist because I refused to do illegal work for HSBC,0,,
"I always wanted to see Reaper's face looking like he endured an explosion, but haven't seen it yet, so I did it mes…",0,,
My grandmother family was killed by the #Nazi in #Poland. She survived since she came to Palestine in 1920's.…,0,,
