Tweet Text,label (annotator1),label (annotator2),label (annotator3)
Marine Le Pen might just have won the presidential elections in #France - Scandal engulfing Fillon grows.,1,1,
Australia's treasurer tells us his country doesn't plan to walk away from the TPP just because the U.S. pulled out…,2,2,
Milwaukee Man Shot 7 Times Over Matter of Stolen Sunglasses; Suspect at Large,1,1,
Australia set 370-run target for Pakistan. #PakvAus #5thODi,0,0,
Inside sick illegal UK puppy farms where breeder left dogs in complete darkness 'close to death' (graphic images)…,1,1,
Police are appealing for help in tracing a missing 12 year-old-boy from Wetherden -,1,1,
Jake's & Cooper's Wine Bar in Manayunk reopens - 6 months after a flood,0,0,
"Case back in court this am involving Royal Canadian mint worker found guilty of smuggling $165,000 of gold in rectum #ottnews",1,1,
"With the Orange cucky doll in the white house. The hits just keep on coming, this guy is already the biggest joke in Presidential history!",0,0,
Just imagine... if Russian troops were amassed on America's borders (Op-Edge by @NeilClark66),1,1,
Maine Sen. Angus King Says He'll Vote Against Pruitt Nomination,1,2,
"US Political Divide Seeps Into Football, Super Bowl",1,1,
“Billie Jean” was about a girl who climbed over Michael Jackson's wall one morning and accused him of being the father of one of her twins.,0,0,
Are Jamie and Bianca really dropping the L Bomb after a few days of kissing?! What are they? 12?! #CBB,0,0,
"McCain slams Trump: Withdrawing from TPP is a ""serious mistake""",2,2,
"white feminists speaking about the dress code & catcalling vs racism, transphobia, & ableism",0,0,
Three Arrested After Woman's Rape Livestreamed on Facebook,1,1,
The violence in Chicago largely stems from a world of no hope. Beefing up police won't do that,1,1,
#Nawazsharif forbidden from making speech in Davos due to corruption investigation,1,1,
Austrian police arrest 14 in terror raids,1,2,
Global Crude oil price of Indian Basket was US$ 53.46 per bbl on 20.01.2017,1,1,
Uhuru is expected to pray for Garrisa victim to resurrect and become voters in August #UhuruTenaGarissa,1,1,
Voters passed this measure to police ethics & campaign in South Dakota. Now lawmakers are considering a repeal:,1,1,
How much evidence of mental imbalance would it take for the GOP Congress to move to curtail/impeach/25th Amendment Trump.,0,0,
"America will have to unite to acknowledge, w/o blame, a love for country that transcends its leader. Via Carl Sagan:",0,0,
Let's talk about the biggest slept on song from bangtan. And yes even more than Run. I'm talking about Young Forever.,0,0,
Weed helped me not kill somebody today.. Murder and Marijuana can't both be illegal..,0,0,
"From Kashmir to Kerala & Guj to Bengal, #CongressGheraosRBI to protest against the demonetization disaster & underm…",2,1,
Lee Jun Ki's agency denies he's dating IU,0,0,
The finest behind the scenes TV photo ever taken. The cast of Allo Allo and Doctor Who mingle during a fire alarm a…,0,0,
"01-25 Day starter Top stories: Julian Assange vindicated? Ghomeshi trial resumes, Bosma trial latest #JulianAssange",0,0,
Scotland eyes 50% renewable energy by 2030 in shift away from North Sea oil,2,2,
The scariest movie at Sundance was a documentary about Hulk Hogan,1,1,
"Bedford Row Brian Altman QC ""Criminal Prosecution File"" FSB SVR MOST WANTED MUG*SHOTS #KREMLIN ARMOURY MUSEUM TRUST",0,0,
"Forecast Wed: Pockets of Moderate, locally High pollution, mainly SE England. Otherwise Low. #ukair",1,1,
Don't get why Liverpool fans are getting gassed over this look what happened with Suarez,0,0,
B.A.P vs. EXO - K-Pop Top 40 of 2016 via @fusetv,0,0,
"After a plane crash claimed the lives of almost the entire team, Chapecoense are rebuilding to honour the fallen.…",1,1,
Former Harrisburg mayor's Wild West obsession leads to trial tomorrow on 112 counts of receiving stolen property,2,2,
"London will remain Europe's most important financial hub, Santander Chairman Ana Botin says",2,2,
@GreggJarrett Part of the Douchacratic plan to hinder the new POTUS through harassment. Soviet plants in the Dem party?,2,2,
"Oh, honey. NBC is bringing back ""Will & Grace.""",1,1,
LeBron James Zings Donald Trump 'Goofy Votes',1,1,
"UPDF Generals, Police AIGPs & Uganda Prisons Commissioners help the President decorate awardees #LiberationDay17",1,1,
Pls help us find #missing 13yo Keyanna Hull. Last seen Thurs at Cribbs Causeway. May have got bus to London. Pls RT…,0,0,
Hundreds Of Muslim Refugees Arrested For Rape & Child Molestation Across The UK Are Overwhelming The Prison System,1,1,
The tongue can set an entire forest ablaze with fire and destroy it.It can also release water to weary souls.It's always a matter of choice.,0,0,
Good year to be a Patriots fan. Your team is likely going to the Super Bowl and your presidential candidate was elected.,0,0,
"To help @realDonaldTrump fight fraud, BadlandsNP has identified 323 obviously fake voters here in Jackson Co., SD.…",1,1,
This is how the communists behave against the nationalists whether its West Bengal or Kerala. #Kannur,0,0,
"This means the march route's entirely flooded: Michigan, Wabash, State are packed, people still waiting for trains into city @chicagotribune",1,1,
Microsoft Asserts Clientsí Rights in FBI E-Mail Searches Fight,2,3,
Biafrans Trump Rally - Killings by Nigerian Army 4,0,2,
Arcanine 87% (15/12/12) bite fast/fire blast) till 20:16:31 (19m 31s),0,0,
Country which elected president who hinted Obama was born in Kenya and that Sen Cruz's dad might have killed JFK is shocked President lies,1,0,
#nrp mending beli album bts yang baru atau lightstick army bomb ver 2?,0,0,
"Blacks and Hispanics cause disproportionately higher traffic deaths and injuries, accordi…",0,0,
It is striking how MSM are normalising the fascist Trump while continuing to undermine and trash the socialist Corbyn.,0,0,
Does the baby really *have* to be tied to the time bomb? It's hardly going to defuse the thing then alert the authorities,0,0,
The Shias of Mumbai in clothes symbolizing the Battle of Karbala protesting Yazidiyat at Kurla Moharam procession.…,0,0,
"*GEJ in Washington - Deji Adeyanju, self-acclaimed PDP operative, exposed as peddler of lies and fake reports",1,1,
Soldiers are standing up against religious discrimination of Muslims. I'm a veteran and I stand with my Muslim brot…,0,0,
"If you were the Nazi that was bumped by Shia LaBeouf, make sure you contact the Alt-Right's preferred lawyer.…",0,0,
Try this spicy Moroccan carrot salad recipe for Meatless Monday,0,0,
Cardin/Schumer/Graham/McCain to drop bill this week to make any changes to Russian sanctions subject to Congressional vote.,2,2,
Pearl Jam to be inducted to Rock and Roll Hall of Fame by legend Neil Young this spring,2,2,
Trump Strategist Steve Bannon Says Media Should ‘Keep Its Mouth Shut’ -,2,2,
BT lines up new Europe boss after Italy accounting scandal,1,2,
"[INFO] 170127 Minzy to sing the OST for MBC's new drama 'Rebel: Thief Who Stole the People', to be released soon",0,1,
"World's so called largest democracy, that has caged millions, killed millions, abducted and raped thousands, blinded hundreds #BlackDay",0,0,
"We're sorry to hear that Gordon Kaye, who played Rene in 'Allo 'Allo has died at the age of 75. Our thoughts are wi…",1,2,
Police investigation against Kejriwal for 'alleged' corruption in construction of a 'Drain' while BJP MCD looted 19…,1,1,
"Frivolous remark today by DUP Chair, Lord Morrow, about the boilers all being on, shows DUP just doesn't get it. Voters do.",1,1,
After Egypt shuttered dreams of Ugandans in #AFCON2017 they've started sharing bible verses,0,0,
ATTI: #ML30WR Bus 293 on the West Run Route is at the intersection of West Run and Stewartstown Road: 1/25/2017 7:26:08 AM,0,1,
Corruption Probe Against Babus Must Conclude in 90 Days: Government New guidelines,1,1,
This is a Cornwall liberal appreciation thread carefully listing every person who resisted the toxic conservative environment of my hometown,0,0,
Astana Peace Talks: Turning Point for Syria and World Politics? #Gold,0,0,
Iran starts sending own oil tankers to Europe,0,1,
"@HillaryClinton @FoxNewsInsider Hillary, continue fighting for a Weak America. Another Run OK, lets see what it brings ,",1,0,
"UK warning over traditional toast, potato diet - Shanghai Daily (subscription)",0,1,
"Fans of slave-raping Islamic State fly the flag in London, Jersey & outside the White House.",1,1,
"WATCH: Police in Texas release surveillance video they say shows shoplifter stuffing $1,700 guitar down his pants:",1,1,
Zendaya via Vogue's Snapchat (voguemagazine): This girl is on fire #womensmarch,0,0,
"Transnet's new locomotives are unusable because they ""vibrate excessively"" & would thus spill the gravy.",0,1,
America is facing a crisis never before seen in our times. The majority of Americans question whether POTUS was installed by Russia. Act.,1,0,
Skelms: Ford ‘obstructing’ police probe of fatal Kuga fire - Times LIVE via @TimesLIVE,1,1,
If only Chicago cared this much about their kids who are getting killed on a daily basis there.,0,0,
",Nigerian military killed over 20 unarmed #Biafrans celebrating #DonaldTrump's Inauguration",1,1,
"20-year-old Birrigun Dunn-Velasco, the lead singer of band Dispossessed, has been charged after trying to light the Aus flag on fire.",1,1,
"#Morocco-exchange of fire reported during raid against #ISIS cell planning an attack. Firearms, knives and bomb mak…",1,2,
Black Trump supporter stands in middle of Women’s March and absolutely goes off on shocked crowd…,1,1,
One of #Russian banks financially meddling /w US elections was Alfa Bank. What could have been the second?…,1,1,
RBS takes $4bn hit over US mis-selling scandal:,2,2,
"Gloria Steinem says marchers in Berlin wanted to share this message: ""We in Berlin know that walls don't work""…",2,2,
"Sevilla given the same punishment Sporting Gijon got for racist chanting. In effect, they are saying racist chanting is the same as rivalry.",0,0,
"Meanwhile, they want to rewrite field manual to allow EIT. Puts U.S. forces at risk worldwide for no inte…",0,0,
Dobbs: Corporate America deployed its media assets to attack Trump,0,2,
Quite a few callers & followers today asked how rockslides are removed. Here's a brief glimpse behind today's Kern…,0,0,
"While Trudeau talked a good game on climate, critics say his actions have been in stark contrast to that rhetoric.…",1,2,
Poll: 74 Percent of Californians Want to End Sanctuary Cities,2,2,
"To understand life on Earth, it's worth reading what killed almost everything in the 5 big mass extinctions:…",0,0,
Powerful 7.9 earthquake hits Solomon Islands,3,3,
"What happens when Victor the polar bear at Yorkshire Wildlife Park needs a dentist? Get the fire service, of course…",1,1,
"Marie Connolly Owens, America's First Female Police Officer",0,0,
nvr posted a finished pic of this on twitter! oil & acrylic on 2ftx2ft wood panel. doin prints for $13 & shipping o…,0,0,
Bomb threat stay classy Madison,1,1,
"Nor'easter will bring high wind/snow to Northeast Mon./Tues. Latest forecast on Local Now. Available on Apple, Andr…",1,1,
Chris Johns: Weakness of German banks a systemic threat to euro itself via @IrishTimesBiz,1,2,
Our thoughts and prayers are with the @CLEpolice & family of Police Officer David Fahey who was killed in the line of duty today.,0,1,
LAWSUIT FILED AGAINST BANC OF CALIFORNIA: Hagens Berman Alerts Investors in Banc of California to Securities...,0,2,
Manchester City fans at Wembley. 1969 FA Cup Final,0,0,
Temperatures Drop In Mass. As Arctic Cold Blast Moves In #Arctic #arctic,0,1,
4' Lukman slips @cosmosdauda14 through on goal. The ball bounces up in front of the strike but his shot rises just over the bar. #AHOSC 0-0,0,0,
Home Ministry transfers Motihari case (where bomb was found on railway track in Oct'16) to NIA,1,1,
"Scientists discover material that conducts electricity but not heat, violating the Wiedemann-Franz law…",1,1,
I'm starting to become and embarrassed Fox news by having Shepard Smith on your news shows,0,0,
Trump Kept FBI Traitor Comey As Director & Wants Us To Believe Comey Is Going To Investigate Election Fraud…,1,1,
Chapman student's nonprofit plans to open $2 million soap factory in Kenya,1,1,
if you hope Erdo_an gets to the bottom of pizzagate... starting to suspect Gülen is involved,0,0,
3/4 Accident on Riversands Blvd before Rose Road - delay leaving Diepsloot.,0,0,
Damning indictment of AAP's fraud politics,1,1,
National Park Service staff escalate campaign against Trump,2,2,
"Biafra: You Are The Fraudster Not Nnamdi Kanu— Prophet Nwoko Blasts Uwazuruike, Warns Against Sabotaging Biafra……",0,0,
"Of these six, Iran and Sudan neither have a major terrorism problem within their soils. Sudan doesn't even have a minor terrorism problem.",0,0,
White working class women died fighting fascism. Let's not dismiss them and their struggle to justify anger at one US election statistic.,0,0,
"Perfect shot of the beautiful sunrise, the horizon and the fishing boat at The Sands at Chale Island Cc…",0,0,
"#FZ25 gets great styling, 20.5 BHP & 20 Nm, LED headlamps. No ABS, no liquid/oil cooling #NewAgeMacho…",0,0,
Soros pays fake left to get arrested,0,0,
During the 9-year 'war on science' in Canada federal scientists were prevented from sharing research with public.,0,1,
#KolesCoinNews | Video Crypto News: | Warning for Zcash users:,0,0,
James Eagem Holmes murdered 12 people and injured dozens of others in the 2012 Aurora movie theater shooting,0,0,
Oregon just showed states how to fight back against the war on women,1,1,
Safe Steps! ! Promoting Road Safety looking out for the vulnerable road users helping to make Grea…,0,0,
"A union representing Centrelink workers has written to minister Tudge saying staff are under ""extraordinary stress""…",0,1,
BOOM! Sheriff Clarke DESTROYS Liberal “Snowflake” Who Made Complaint With THIS SERIOUS “THREAT”…,0,0,
"Naturally, Piers Morgan’s Response to the Women’s March Is Generating Anger",0,1,
King's College London admits it is monitoring students' emails,1,1,
The Stanford Rapist's Judge Just Gave Three Years To A Latino Man For THE SAME Crime,0,1,
Kellyanne Conway's appearance today was like the Jedi mind trick if you dropped out of Jedi classes after level one.,0,0,
"Julie Andrews calls the late Mary Tyler Moore a ""joy to work with.""",1,1,
"Middle class kenyans shud b on fire with calls 2resign but no, they wait 2go talk in bars and salons, shrug, pay hi…",0,0,
Trump & Pence's lies corrode & corrupt fundamental tenets of our democracy. Excruciating to watch this happening.,0,0,
"See Chris Froome is his first race of 2017. Tomorrow, 12:30pm, at the Albert Park GP circuit, Race Melbourne Toward…",0,0,
Man Arrested For Genitally Mutilating Two-Year-Old Girl At Home,0,1,
Fire service considers cuts to fire alarm response at commercial premises - Article by Business MK,0,1,
Kellyanne Fights 'Dramatic' Chuck Todd On Inauguration Crowd | The Daily Caller,1,2,
Patient’s Fart Sparks Serious Fire During Laser Surgery,0,0,
Tribute to the Life & Times of the great Nepali Rapper Yama Buddha Founder of Rap Battle Raw Barz and his...,0,0,
Used maybe for blackmailing. Pizzagate is just a new silly name for old thing. Investigation here…,0,0,
"Cheers ERUPT as the anti-war bloc joins BLM at the checkpoint shut-down. ""No justice, no peace"" becomes ""BLACK LIVE…",1,1,
"NYC water protectors trapped inside barricades! ""Show me what a police state looks like!"" #NoDAPL #kXL #DAPL",0,1,
SoCal residents are bracing for Sunday's storm after Friday's system struck the region,1,1,
Which teams have the best shot at an appearance in Super Bowl LII?,0,0,
Here's How @POTUS Could Make Mexico Pay for the Border Wall,2,1,
This Behind-the-scenes Footage of SHINee’s “Everybody” MV Is Too Funny Watch the video:,0,0,
"Bremerton Police seize $650 in cash & a ""substantial amount"" of meth in a raid on a known drug house. So far no arr…",1,1,
Blockchains are the future of VC funding. Agree or disagree? Tell us here,0,0,
Theresa May omitted to mention this to Parliament when she sought £40 billion for Trident,1,1,
From Journal of Electoral Studies: Do Noncitizens Vote in US Elections? (Sure they do),0,0,
Labor secretary nominee’s confirmation hearing delayed again,2,2,
USA looses millions of in medical care write offs in caring for illegal immigrants & in education who reimburses USA,1,1,
"Peaceful Protest: 750,000 People Went to the L.A. Women's March - and Zero Got Arrested",1,2,
Zoos across the U.S. participated in #cuteanimaltweetoff because hope is not dead,1,1,
Rose left out front of Mary Tyler Moore's TV home in Minneapolis. #kare11,0,0,
Reports: Allman Brothers' Butch Trucks committed suicide in front of his wife,1,1,
"Endured -15C dressed in a flimsy medieval costume to capture the best of footage for the upcoming ""Weaver of Odds"" book trailer. #backtowork",0,0,
Disturbing Footage Showing Lesbian Pretoria Students Having S2X Behind The Library Causes Stir…,0,0,
Massive wildfire breaks out in Kunjo,1,2,
Justice for porcupine beaten to death with baseball bat! Plz sign:,0,0,
"NOT FAKE NEWS IS THE FACT, Their has never been a Palestinian state. FAKENEWS is a 2 state solution when Islam denies Jews",0,0,
"#RailaPresser.Hello Kenyans kindly tell me where Kabura,Ben Gethi and all the NYS scandal went to.",0,0,
#HuffingtonPost Tube Strike: London Underground Workers To Stage Two Strikes Next Month,1,2,
"@Border_Angels deport him..he can be ""proudER"" to be Mexican in Mexico. Build the wall and end ILLEGAL IMMIGRATION. T",0,0,
Warning area (blue) & the estimated impact area for Bushfire ADVICE current for Argyle & Gwindinup. Downgraded due…,1,1,
Sentenced: Watford drink driver who led police on 20-mile chase before crashing into health centre,1,1,
"Fugitive former UT student surrenders in 1983 rape, killing of young Austin mom | @debruijneline",1,1,
".@legocopgta created Toronto police Lego figures as a hobby, but now he’s overwhelmed at the demand for his work.…",0,0,
"Tornado warning for Autauga Co, along AL Hwy 14, moving E. Take Cover #alwx",2,2,
"Tell Your Rep, ""Vote No on HR 7, Yes for Women's Healthcare."" Shocking details of this anti-woman bill here:",0,1,
"Police Sgt. Sean Hill was attacked, hit in the head and knocked unconscious by Hillary supporters protesting Presid…",1,1,
D.C. riot was well organized -,1,1,
Safety alert issued on search for Federal Inmate David Maracle who escaped from Kingston correctional facility…,1,1,
Appointments of Goldman-linked people to the Trump administration heightens fears over Wall Street's grip on DC,2,2,
Why Democrats should filibuster whoever Trump nominates for the Supreme Court:,2,2,
"Cat Hog-Tied, Set on Fire, and Thrown From Window–Demand Justice!! #StopAnimalCruelty #StopAnimalAbuse #animalrights",0,1,
"Conservatives didn't want boots on the ground in Syria (good), but they'll send their children to die in an absurd Trump's…",1,1,
Every bullshit right wing news story that ever passed thru Breitbart or the Daily Caller is now national policy.,0,0,
Are Trump & Mexican President Provoking Conflict to Distract from Low Approval Ratings at Home?…,3,3,
S/o to the smash group chat for this imminent existential crisis,0,0,
"POTUS & VP want to silence health facts, Didn't Pence learn his lesson when he triggered an HIV outbreak as Gov.?",3,3,
Dim the Fluorescents': The Corporate Training Seminar That Became a Slamdance Grand Jury Prizewinner,0,0,
Excited to Announce Session III of the Adidas Select Series in Washington DC (New 24) will have grades 3rd-8th part…,0,0,
"Let us pray for the grace of a fresh start for many people who lost all to,fire, flood,motor accident or plane crash and other disasters.",0,0,
#mitedp Panorama shot from the final day of the Entrepreneurship Development Program 2017 at MIT,0,1,
"State Dems say AG @RepBecerra will fight to defend protections for the gay and lesbian community, women & immigrants",1,2,
"Storm teams are heading home today from Hattiesburg, after helping Mississippi Power following tornadoes that struc…",1,1,
Iran--the leading state-sponsor of terrorism--continues its domestic repression. H/T @RonnyNaftaniel,0,1,
Martellus Bennett having the time of his life dancing to some Whitney Houston,1,0,
"Rachel Maddow: Trump's climate gag order means ""data is disappearing""",2,2,
"(Sylvania, Harroun Park) Pikachu 33% (7/8/0) quick attack fast/discharge) till 23:45:20 (29m 34s)",0,,0
"Discussion of psycho-social issues is most important convo the MD can have with a cancer survivor -Mary Flowers, MD of @fredhutch #survonc17",0,,0
we are loyal warriors we fight for this show everyday if bellarke isn't endgame I'm setting fire to my house with m…,0,,0
"EMERGENCY WARNING Mcinerney Rd, Camberwell. Fire crossed New England Hwy towards Camberwell Village. Shelter in place as fire front arrives.",1,,1
Ex-Bank of England governor is critical of central banks for losing focus and humility,2,,2
"Sanchez Energy's Acquisition Of Anadarko Acreage - Getting Bigger, But Not Necessarily More... $APC $SN",1,,2
Dinah CHICKENS ATTACK #5HBestFans,0,,0
US Crude Oil Supply Forecast #OOTT,1,,1
First pass PRB Bill 2012 pending in Parliament...still running on old PRB Act 1867 for newspapers and books…,1,,1
Most Abused Words in Mid East: Honor Martyr Justice Truth Occupation Racist Zionist Rights Man God Pure Palestine A…,0,,0
"So is getting shot in the kneecaps Jez. Didn't stop you supporting the IRA though, did it? Awkward.",0,,0
Finding Common Ground Through Climate Change Conflict #CSR,0,,0
Car driver dies during lorry crash on A14 at Creeting St Mary,1,,1
"Ministers, police vehicles to pay toll fares - Bulawayo24 News",1,,1
Richard Spencer was giving an interview with a local news channel about a frog meme before the attack. Now he's international news.,1,,2
"Police probe into allegations of financial irregularities at Lancashire County Council cost £2m, says PCC",1,,1
No Time Like Now To Relax Fiscal Deficit Target; DeMo Is India's Lehman Redux - Swarajya -,1,,1
"Well, they may not get to march. But there r a thousand shards of Trump's ego spread around Washington. So next time",0,,0
"This is flagrantly false, & Trump's rhetoric has dangerous consequences. Thanks to partisan polarization, many Repu…",0,,0
Booth and Brennan in an explosion.mp4 - Booth and Brennan in an explosion. A video shared with Dropbox.,0,,0
FBI identifies WhatsApp as next target while court case with Apple goes on #WhatsApp #WhatsApp,2,,3
shinee are a talented unproblematic group they have no scandals and they haven't lost any members how do people not stan them,0,,0
"Anonymous: Bikers For Trump(footage), DisruptJ20, Donald Trumps Inaugura...",0,,1
Chaim Rumkowski hoped & failed to save Lodz's Jews by cooperating & aiding Nazis. He was killed by fellow prisoners…,0,,0
TopNews: Farmers suicides: Supreme Court seeks government response - Financial Express,1,,1
Declassified CIA file predicted 5 crucial signs Biafra push would be a disaster in 1967 -,0,,0
"BI Comm Robles said when Calima told them he had cctv copies of alleged bribery,he also said ""di nyo kasi ako sinasama"" @News5AKSYON",1,,1
"Albany, GA Tornado. Houses damaged, trees down everywhere, luckily haven't seen any injuries yet",2,,2
Chick-fil-a's owner is a Trump supporter! Me: Damn dats crazy...,0,,0
Aquino said he was not liable for Oplan Exodus because police operations do not need approval from the president.,1,,2
Bus full of Montrealers enroute to the Washington Mall to join 100s of thousands of women in post election protest.…,0,,0
"@sahouraxo the soon the be next victim of the ""Assad must go"" curse",0,,0
Seriously?': Edmonton police issue $465 ticket for cracked driver's licence,1,,1
Matt Damon plans to pitch Trump on clean water,2,,2
"South Georgia needs your prayers now more than ever. 11 lives lost, 19 people injured in last night's storms. #gawx…",2,,3
King and POTUS making up different voter fraud stories. Like True and me telling each other dinosaur stories except…,0,,0
"Rescue helicopter crashes in central Italy, 6 killed",2,,2
WEATHER ALERT: The wind and rain are causing trees to fall and streets to flood. Please use caution on the roads,1,,1
Mayor Garcia joined @District2LB and AO7 community at their clean up this morning - committed residents working to…,0,,0
"Yeah, I wish you could tell this to Qandeel Baloch and several like her who are beaten & even killed for not wearin…",0,,0
Traffic police barred from serving as guard or gunmen for any officer #Karachi,0,,1
Near fatal racial hate crime beating in Lower East side of NYC,1,,1
"Tories renege on promise that Scotland will be treated as equal, and ignore Scotland's vote to #Remain. Message to them is #novoicenoexit",1,,1
shieldsgazette_.com Karl Darlow on the threat posed to Newcastle by Brighton and THAT save against,0,,1
Brexshit is Crisis.. This is how the Tories operate vulture capitalism exists in Crisis,0,,0
Tornado Warning for Clinch and Echols Counties in GA until 10:00 AM EST,2,,2
#NEWS || Minister Martinez: “We have made considerable progress in the oil prices recovery within a short time”,3,,3
"Racist thug jailed for ""appalling"" attack on Asian shopkeeper",0,,1
"Assessing the latest options in the H20 aisle—alkaline, boxed, Ice Age–era. Plus: A tasting with Adam Platt",0,,0
I suspect Chelsea Handler heard Melania speak French and--being the ignorant rube she is--concluded: That woman doe…,2,,0
